{
  "state_id": "2025-12-22_placeholder_bayesian",
  "timestamp": "2025-12-22T20:20:00Z",
  "zenodo_doi": "10.5281/zenodo.0000002",
  "description": "Placeholder for Bayesian epistemic state demonstrating probabilistic inference framework for 3I/ATLAS interpretations",
  "metadata": {
    "author": "TRIZEL Project Team",
    "version": "1.0.0",
    "tags": [
      "bayesian",
      "probabilistic",
      "3i_atlas",
      "placeholder"
    ],
    "created_date": "2025-12-22",
    "last_modified": "2025-12-22"
  },
  "interpretation": {
    "framework": "Bayesian inference",
    "assumptions": [
      "Prior distributions can be specified for parameters",
      "Likelihood function is well-defined",
      "Posterior updating via Bayes theorem",
      "Probability represents degree of belief"
    ],
    "scope": "Probabilistic interpretation of 3I/ATLAS data using Bayesian framework",
    "methodology": "Bayesian model comparison and posterior inference (placeholder - no actual implementation)",
    "limitations": [
      "Requires prior specification",
      "Computational intensity for complex models",
      "Prior choice affects results"
    ]
  },
  "data_references": [
    {
      "dataset_id": "3iatlat_main_placeholder",
      "zenodo_doi": "10.5281/zenodo.0000002",
      "description": "Placeholder reference to 3I/ATLAS primary observational data",
      "version": "1.0.0",
      "role": "primary"
    },
    {
      "dataset_id": "prior_catalog_placeholder",
      "zenodo_doi": "10.5281/zenodo.0000003",
      "description": "Placeholder reference to catalog data for prior specification",
      "version": "1.0.0",
      "role": "prior"
    }
  ],
  "provenance": {
    "software": [
      {
        "name": "python",
        "version": "3.9+"
      },
      {
        "name": "numpy",
        "version": "1.24.0"
      }
    ],
    "execution_date": "2025-12-22",
    "random_seed": 12345
  },
  "results_summary": {
    "summary_text": "This is a placeholder state demonstrating Bayesian framework structure for future implementations",
    "key_findings": [
      "Placeholder state for Bayesian methodology",
      "Framework structure validated",
      "No actual posterior computations performed"
    ],
    "metrics": {
      "placeholder_posterior_samples": 0,
      "placeholder_bayes_factor": 1.0
    }
  },
  "notes": "This is a placeholder state for Phase-2 initialization. It demonstrates the structure for Bayesian interpretations but contains no actual analysis. Future versions will include real posterior distributions and Bayes factors."
}
