{
  "state_id": "2025-12-22_placeholder_frequentist",
  "timestamp": "2025-12-22T20:20:00Z",
  "zenodo_doi": "10.5281/zenodo.0000004",
  "description": "Placeholder for frequentist epistemic state demonstrating hypothesis testing framework for 3I/ATLAS interpretations",
  "metadata": {
    "author": "TRIZEL Project Team",
    "version": "1.0.0",
    "tags": [
      "frequentist",
      "hypothesis_testing",
      "3i_atlas",
      "placeholder"
    ],
    "created_date": "2025-12-22",
    "last_modified": "2025-12-22"
  },
  "interpretation": {
    "framework": "Frequentist hypothesis testing",
    "assumptions": [
      "Long-run frequency interpretation of probability",
      "Null hypothesis can be specified",
      "Test statistics follow known distributions",
      "Type I error rate control is primary goal"
    ],
    "scope": "Frequentist statistical inference on 3I/ATLAS data using hypothesis testing",
    "methodology": "Classical hypothesis testing with p-values and confidence intervals (placeholder - no actual implementation)",
    "limitations": [
      "Cannot assign probabilities to hypotheses",
      "P-values often misinterpreted",
      "Multiple testing corrections required",
      "No incorporation of prior information"
    ]
  },
  "data_references": [
    {
      "dataset_id": "3iatlat_main_placeholder",
      "zenodo_doi": "10.5281/zenodo.0000004",
      "description": "Placeholder reference to 3I/ATLAS primary observational data",
      "version": "1.0.0",
      "role": "primary"
    }
  ],
  "provenance": {
    "software": [
      {
        "name": "python",
        "version": "3.9.0"
      },
      {
        "name": "scipy",
        "version": "1.11.0"
      }
    ],
    "execution_date": "2025-12-22",
    "random_seed": 54321
  },
  "results_summary": {
    "summary_text": "This is a placeholder state demonstrating frequentist framework structure for future implementations",
    "key_findings": [
      "Placeholder state for frequentist methodology",
      "Framework structure validated",
      "No actual hypothesis tests performed"
    ],
    "metrics": {
      "placeholder_p_value": 0.05,
      "placeholder_test_statistic": 0.0,
      "placeholder_confidence_level": 0.95
    }
  },
  "notes": "This is a placeholder state for Phase-2 initialization. It demonstrates the structure for frequentist interpretations but contains no actual analysis. Future versions will include real hypothesis tests, p-values, and confidence intervals."
}
